{
  "stage_id": "ch06_s08",
  "chapter": 6,
  "stage_number": 8,
  "grid_size": 6,
  "num_colors": 5,
  "turn_limit": 28,
  "goal": {
    "type": "destroy_blocks",
    "target_count": 36
  },
  "star_thresholds": [
    1,
    5,
    9
  ],
  "color_queue_config": {
    "stride": 3,
    "random_offset": 1
  },
  "gimmick_placements": [
    {
      "type": "ice",
      "x": 1,
      "y": 1,
      "durability": 1,
      "data": {}
    },
    {
      "type": "locked",
      "x": 4,
      "y": 4,
      "durability": 1,
      "data": {}
    },
    {
      "type": "rainbow",
      "x": 0,
      "y": 2,
      "durability": 0,
      "data": {}
    },
    {
      "type": "stone",
      "x": 5,
      "y": 2,
      "durability": 0,
      "data": {}
    },
    {
      "type": "paint_bucket",
      "x": 2,
      "y": 0,
      "durability": 0,
      "data": {
        "paint_color": 2
      }
    }
  ],
  "buffer_rows": 6,
  "metadata": {
    "name_ko": "막판 승부",
    "story_preview_key": "ch06_s08_preview"
  }
}