{
  "stage_id": "ch02_s03",
  "chapter": 2,
  "stage_number": 3,
  "grid_size": 5,
  "num_colors": 3,
  "turn_limit": 11,
  "goal": {
    "type": "destroy_blocks",
    "target_count": 18
  },
  "star_thresholds": [
    1,
    3,
    5
  ],
  "color_queue_config": {
    "stride": 3,
    "random_offset": 1
  },
  "gimmick_placements": [
    {
      "type": "ice",
      "x": 1,
      "y": 1,
      "durability": 1,
      "data": {}
    }
  ],
  "buffer_rows": 5,
  "metadata": {
    "name_ko": "엇갈린 색",
    "story_preview_key": "ch02_s03_preview"
  }
}
