{
  "stage_id": "ch01_s01",
  "chapter": 1,
  "stage_number": 1,
  "grid_size": 5,
  "num_colors": 3,
  "turn_limit": 8,
  "goal": { "type": "destroy_blocks", "target_count": 20 },
  "star_thresholds": [1, 3, 6],
  "color_queue_config": { "stride": 3, "random_offset": 1 },
  "gimmick_placements": [],
  "buffer_rows": 5,
  "metadata": { "name_ko": "색깔의 세계", "story_preview_key": "ch01_s01_preview" }
}
