{
  "stage_id": "ch01_s07",
  "chapter": 1,
  "stage_number": 7,
  "grid_size": 6,
  "num_colors": 4,
  "turn_limit": 15,
  "goal": { "type": "destroy_blocks", "target_count": 20 },
  "star_thresholds": [1, 3, 6],
  "color_queue_config": { "stride": 3, "random_offset": 1 },
  "gimmick_placements": [
    { "type": "coin", "x": 1, "y": 1, "durability": 0, "data": {} },
    { "type": "coin", "x": 4, "y": 2, "durability": 0, "data": {} },
    { "type": "coin", "x": 2, "y": 4, "durability": 0, "data": {} }
  ],
  "buffer_rows": 6,
  "metadata": { "name_ko": "보물 사냥", "story_preview_key": "ch01_s07_preview" }
}
