{
  "stage_id": "test_gimmick_story",
  "chapter": 0,
  "stage_number": 0,
  "grid_size": 7,
  "num_colors": 4,
  "turn_limit": 100,
  "goal": { "type": "destroy_blocks", "target_count": 50 },
  "star_thresholds": [20, 30, 40],
  "color_queue_config": { "stride": 3, "random_offset": 1 },
  "gimmick_placements": [
    {"x": 0, "y": 0, "type": "stone"},
    {"x": 3, "y": 0, "type": "stone"},
    {"x": 6, "y": 0, "type": "stone"},
    {"x": 1, "y": 1, "type": "locked", "durability": 1},
    {"x": 5, "y": 1, "type": "locked", "durability": 1},
    {"x": 2, "y": 2, "type": "ice", "durability": 2},
    {"x": 4, "y": 2, "type": "ice", "durability": 2},
    {"x": 3, "y": 3, "type": "rainbow"},
    {"x": 0, "y": 4, "type": "anchor"},
    {"x": 6, "y": 4, "type": "anchor"},
    {"x": 1, "y": 5, "type": "paint_bucket", "data": {"direction": "row"}},
    {"x": 5, "y": 5, "type": "paint_bucket", "data": {"direction": "col"}},
    {"x": 2, "y": 6, "type": "coin", "data": {"coin_value": 10}},
    {"x": 4, "y": 6, "type": "chain_mult"},
    {"x": 0, "y": 3, "type": "star"},
    {"x": 6, "y": 3, "type": "spread"},
    {"x": 3, "y": 6, "type": "fade", "data": {"original_color": 1, "revert_turns": 2, "turn_counter": -1}}
  ],
  "buffer_rows": 7,
  "metadata": { "name_ko": "기믹 통합 테스트 (스토리)", "description": "S07 13종 기믹 스토리 모드 검증용" }
}
