{
  "stage_id": "ch01_s03",
  "chapter": 1,
  "stage_number": 3,
  "grid_size": 5,
  "num_colors": 3,
  "turn_limit": 10,
  "goal": { "type": "destroy_blocks", "target_count": 18 },
  "star_thresholds": [1, 3, 5],
  "color_queue_config": { "stride": 3, "random_offset": 1 },
  "gimmick_placements": [
    { "type": "rainbow", "x": 2, "y": 2, "durability": 0, "data": {} }
  ],
  "buffer_rows": 5,
  "metadata": { "name_ko": "무지개 빛", "story_preview_key": "ch01_s03_preview" }
}
