{
  "stage_id": "ch01_s10",
  "chapter": 1,
  "stage_number": 10,
  "grid_size": 5,
  "num_colors": 3,
  "turn_limit": 9,
  "goal": {
    "type": "destroy_blocks",
    "target_count": 57
  },
  "star_thresholds": [
    1,
    2,
    5
  ],
  "color_queue_config": {
    "stride": 3,
    "random_offset": 1
  },
  "gimmick_placements": [
    {
      "type": "locked",
      "x": 1,
      "y": 1,
      "durability": 1,
      "data": {}
    },
    {
      "type": "locked",
      "x": 3,
      "y": 0,
      "durability": 1,
      "data": {}
    },
    {
      "type": "locked",
      "x": 4,
      "y": 4,
      "durability": 1,
      "data": {}
    },
    {
      "type": "rainbow",
      "x": 0,
      "y": 3,
      "durability": 0,
      "data": {}
    },
    {
      "type": "rainbow",
      "x": 4,
      "y": 2,
      "durability": 0,
      "data": {}
    },
    {
      "type": "chain_mult",
      "x": 2,
      "y": 4,
      "durability": 0,
      "data": {
        "multiplier": 2
      }
    },
    {
      "type": "chain_mult",
      "x": 4,
      "y": 1,
      "durability": 0,
      "data": {
        "multiplier": 2
      }
    },
    {
      "type": "star",
      "x": 3,
      "y": 3,
      "durability": 0,
      "data": {
        "bonus_turns": 3
      }
    }
  ],
  "buffer_rows": 5,
  "metadata": {
    "name_ko": "최후의 결전",
    "story_preview_key": "ch01_s10_preview"
  }
}